FREE Webinar on TOEFL Test Preparation With Certificate,https://geeksgod.com/free-toefl-masterclass/
PCB Designing Workshop For Beginners,https://youtu.be/L5mZAFVGzuM
Data Science Career Opportunities For Students,https://geeksgod.com/free-are-you-a-data-science-enthusiast-register-now/
TypeScript Workshop From Scratch,https://rb.gy/ebtfgo
(LIVE Now) Data Science Career Opportunities For Students,https://geeksgod.com/free-are-you-a-data-science-enthusiast-register-now/
(LIVE Workshop) Data Science For Beginners,https://youtu.be/ONDn9PW5RmY
Online Webinar By BARC Scientist,https://geeksgod.com/do-you-want-to-crack-gate-barc-drdo/
(Workshop) Create your first game | Introduction to game development,https://geeksgod.com/game-development-with-c-microsoft-learn-student-ambassadors-workshop/
[LIVE WEBINAR] Crack GATE/BARC/DRDO 2021,https://youtu.be/c6eRciox3Yw
"Workshops on SoP, LoR, Resume, Interviews, and more.",https://geeksgod.com/2-days-virtual-mentor-conference-on-19th-and-20th-december-2020/